{
  "convention": "run@1",
  "id": "5b0f6a3e-2c1d-4e7a-9f55-0a1b2c3d4e5f",
  "key": "1868d5c1a7f061da807f685184bed5b797f87d6b516f86c56bd70a61c1170087",
  "name": "sod-400",
  "code": {"name": "titan", "version": "0.4.2", "commit": "0123456789abcdef0123456789abcdef01234567", "dirty": false},
  "problem": {"name": "sod", "version": "2", "params": {"gamma": 1.4}},
  "host": {"hostname": "node17", "os": "Linux 6.1", "argv": ["titan", "--params", "params.json"]},
  "lineage": {},
  "status": {
    "state": "done",
    "started_at": "2026-10-19T14:02:11.503Z",
    "ended_at": "2026-10-19T14:09:40.120Z",
    "exit": {"code": 0, "label": "ok"},
    "last_event_seq": 7
  }
}
